{
  "$schema": "./calendar-regression-scenarios-v1.schema.json",
  "version": "calendar-regression-scenarios-1.0.0",
  "ruleVersion": "lunar-rules-1.0.0",
  "ruleChecksum": "672afbe92debc305bbdac80434cbdbcd8a0295e46fb81e5b210355f6ca318c7c",
  "goldenChecksum": "794c779615b721259c09336cd76a8b1047c4a4ac4bc5b678818707651cff134a",
  "scenarios": [
    {
      "id": "GREGORIAN_YEARLY_001",
      "category": "GREGORIAN_YEARLY",
      "title": "公历 1-1",
      "fromDate": "2026-06-19",
      "event": {
        "calendarType": "GREGORIAN",
        "datePayload": {
          "year": 2024,
          "month": 1,
          "day": 1,
          "timezone": "Asia/Shanghai"
        },
        "repeatRule": {
          "type": "YEARLY",
          "leapDayPolicy": "FEB_28",
          "missingLunarDayPolicy": "LAST_DAY_OF_MONTH",
          "leapMonthPolicy": "NORMAL_MONTH_FALLBACK"
        }
      },
      "expected": {
        "status": "VALID",
        "nextOccurrence": "2027-01-01",
        "futureOccurrences": [
          "2027-01-01",
          "2028-01-01",
          "2029-01-01",
          "2030-01-01",
          "2031-01-01"
        ]
      }
    },
    {
      "id": "GREGORIAN_YEARLY_002",
      "category": "GREGORIAN_YEARLY",
      "title": "公历 1-31",
      "fromDate": "2026-06-19",
      "event": {
        "calendarType": "GREGORIAN",
        "datePayload": {
          "year": 2024,
          "month": 1,
          "day": 31,
          "timezone": "Asia/Shanghai"
        },
        "repeatRule": {
          "type": "YEARLY",
          "leapDayPolicy": "FEB_28",
          "missingLunarDayPolicy": "LAST_DAY_OF_MONTH",
          "leapMonthPolicy": "NORMAL_MONTH_FALLBACK"
        }
      },
      "expected": {
        "status": "VALID",
        "nextOccurrence": "2027-01-31",
        "futureOccurrences": [
          "2027-01-31",
          "2028-01-31",
          "2029-01-31",
          "2030-01-31",
          "2031-01-31"
        ]
      }
    },
    {
      "id": "GREGORIAN_YEARLY_003",
      "category": "GREGORIAN_YEARLY",
      "title": "公历 2-14",
      "fromDate": "2026-06-19",
      "event": {
        "calendarType": "GREGORIAN",
        "datePayload": {
          "year": 2024,
          "month": 2,
          "day": 14,
          "timezone": "Asia/Shanghai"
        },
        "repeatRule": {
          "type": "YEARLY",
          "leapDayPolicy": "FEB_28",
          "missingLunarDayPolicy": "LAST_DAY_OF_MONTH",
          "leapMonthPolicy": "NORMAL_MONTH_FALLBACK"
        }
      },
      "expected": {
        "status": "VALID",
        "nextOccurrence": "2027-02-14",
        "futureOccurrences": [
          "2027-02-14",
          "2028-02-14",
          "2029-02-14",
          "2030-02-14",
          "2031-02-14"
        ]
      }
    },
    {
      "id": "GREGORIAN_YEARLY_004",
      "category": "GREGORIAN_YEARLY",
      "title": "公历 3-8",
      "fromDate": "2026-06-19",
      "event": {
        "calendarType": "GREGORIAN",
        "datePayload": {
          "year": 2024,
          "month": 3,
          "day": 8,
          "timezone": "Asia/Shanghai"
        },
        "repeatRule": {
          "type": "YEARLY",
          "leapDayPolicy": "FEB_28",
          "missingLunarDayPolicy": "LAST_DAY_OF_MONTH",
          "leapMonthPolicy": "NORMAL_MONTH_FALLBACK"
        }
      },
      "expected": {
        "status": "VALID",
        "nextOccurrence": "2027-03-08",
        "futureOccurrences": [
          "2027-03-08",
          "2028-03-08",
          "2029-03-08",
          "2030-03-08",
          "2031-03-08"
        ]
      }
    },
    {
      "id": "GREGORIAN_YEARLY_005",
      "category": "GREGORIAN_YEARLY",
      "title": "公历 4-5",
      "fromDate": "2026-06-19",
      "event": {
        "calendarType": "GREGORIAN",
        "datePayload": {
          "year": 2024,
          "month": 4,
          "day": 5,
          "timezone": "Asia/Shanghai"
        },
        "repeatRule": {
          "type": "YEARLY",
          "leapDayPolicy": "FEB_28",
          "missingLunarDayPolicy": "LAST_DAY_OF_MONTH",
          "leapMonthPolicy": "NORMAL_MONTH_FALLBACK"
        }
      },
      "expected": {
        "status": "VALID",
        "nextOccurrence": "2027-04-05",
        "futureOccurrences": [
          "2027-04-05",
          "2028-04-05",
          "2029-04-05",
          "2030-04-05",
          "2031-04-05"
        ]
      }
    },
    {
      "id": "GREGORIAN_YEARLY_006",
      "category": "GREGORIAN_YEARLY",
      "title": "公历 5-20",
      "fromDate": "2026-06-19",
      "event": {
        "calendarType": "GREGORIAN",
        "datePayload": {
          "year": 2024,
          "month": 5,
          "day": 20,
          "timezone": "Asia/Shanghai"
        },
        "repeatRule": {
          "type": "YEARLY",
          "leapDayPolicy": "FEB_28",
          "missingLunarDayPolicy": "LAST_DAY_OF_MONTH",
          "leapMonthPolicy": "NORMAL_MONTH_FALLBACK"
        }
      },
      "expected": {
        "status": "VALID",
        "nextOccurrence": "2027-05-20",
        "futureOccurrences": [
          "2027-05-20",
          "2028-05-20",
          "2029-05-20",
          "2030-05-20",
          "2031-05-20"
        ]
      }
    },
    {
      "id": "GREGORIAN_YEARLY_007",
      "category": "GREGORIAN_YEARLY",
      "title": "公历 6-1",
      "fromDate": "2026-06-19",
      "event": {
        "calendarType": "GREGORIAN",
        "datePayload": {
          "year": 2024,
          "month": 6,
          "day": 1,
          "timezone": "Asia/Shanghai"
        },
        "repeatRule": {
          "type": "YEARLY",
          "leapDayPolicy": "FEB_28",
          "missingLunarDayPolicy": "LAST_DAY_OF_MONTH",
          "leapMonthPolicy": "NORMAL_MONTH_FALLBACK"
        }
      },
      "expected": {
        "status": "VALID",
        "nextOccurrence": "2027-06-01",
        "futureOccurrences": [
          "2027-06-01",
          "2028-06-01",
          "2029-06-01",
          "2030-06-01",
          "2031-06-01"
        ]
      }
    },
    {
      "id": "GREGORIAN_YEARLY_008",
      "category": "GREGORIAN_YEARLY",
      "title": "公历 7-7",
      "fromDate": "2026-06-19",
      "event": {
        "calendarType": "GREGORIAN",
        "datePayload": {
          "year": 2024,
          "month": 7,
          "day": 7,
          "timezone": "Asia/Shanghai"
        },
        "repeatRule": {
          "type": "YEARLY",
          "leapDayPolicy": "FEB_28",
          "missingLunarDayPolicy": "LAST_DAY_OF_MONTH",
          "leapMonthPolicy": "NORMAL_MONTH_FALLBACK"
        }
      },
      "expected": {
        "status": "VALID",
        "nextOccurrence": "2026-07-07",
        "futureOccurrences": [
          "2026-07-07",
          "2027-07-07",
          "2028-07-07",
          "2029-07-07",
          "2030-07-07"
        ]
      }
    },
    {
      "id": "GREGORIAN_YEARLY_009",
      "category": "GREGORIAN_YEARLY",
      "title": "公历 8-15",
      "fromDate": "2026-06-19",
      "event": {
        "calendarType": "GREGORIAN",
        "datePayload": {
          "year": 2024,
          "month": 8,
          "day": 15,
          "timezone": "Asia/Shanghai"
        },
        "repeatRule": {
          "type": "YEARLY",
          "leapDayPolicy": "FEB_28",
          "missingLunarDayPolicy": "LAST_DAY_OF_MONTH",
          "leapMonthPolicy": "NORMAL_MONTH_FALLBACK"
        }
      },
      "expected": {
        "status": "VALID",
        "nextOccurrence": "2026-08-15",
        "futureOccurrences": [
          "2026-08-15",
          "2027-08-15",
          "2028-08-15",
          "2029-08-15",
          "2030-08-15"
        ]
      }
    },
    {
      "id": "GREGORIAN_YEARLY_010",
      "category": "GREGORIAN_YEARLY",
      "title": "公历 9-10",
      "fromDate": "2026-06-19",
      "event": {
        "calendarType": "GREGORIAN",
        "datePayload": {
          "year": 2024,
          "month": 9,
          "day": 10,
          "timezone": "Asia/Shanghai"
        },
        "repeatRule": {
          "type": "YEARLY",
          "leapDayPolicy": "FEB_28",
          "missingLunarDayPolicy": "LAST_DAY_OF_MONTH",
          "leapMonthPolicy": "NORMAL_MONTH_FALLBACK"
        }
      },
      "expected": {
        "status": "VALID",
        "nextOccurrence": "2026-09-10",
        "futureOccurrences": [
          "2026-09-10",
          "2027-09-10",
          "2028-09-10",
          "2029-09-10",
          "2030-09-10"
        ]
      }
    },
    {
      "id": "GREGORIAN_YEARLY_011",
      "category": "GREGORIAN_YEARLY",
      "title": "公历 10-1",
      "fromDate": "2026-06-19",
      "event": {
        "calendarType": "GREGORIAN",
        "datePayload": {
          "year": 2024,
          "month": 10,
          "day": 1,
          "timezone": "Asia/Shanghai"
        },
        "repeatRule": {
          "type": "YEARLY",
          "leapDayPolicy": "FEB_28",
          "missingLunarDayPolicy": "LAST_DAY_OF_MONTH",
          "leapMonthPolicy": "NORMAL_MONTH_FALLBACK"
        }
      },
      "expected": {
        "status": "VALID",
        "nextOccurrence": "2026-10-01",
        "futureOccurrences": [
          "2026-10-01",
          "2027-10-01",
          "2028-10-01",
          "2029-10-01",
          "2030-10-01"
        ]
      }
    },
    {
      "id": "GREGORIAN_YEARLY_012",
      "category": "GREGORIAN_YEARLY",
      "title": "公历 10-31",
      "fromDate": "2026-06-19",
      "event": {
        "calendarType": "GREGORIAN",
        "datePayload": {
          "year": 2024,
          "month": 10,
          "day": 31,
          "timezone": "Asia/Shanghai"
        },
        "repeatRule": {
          "type": "YEARLY",
          "leapDayPolicy": "FEB_28",
          "missingLunarDayPolicy": "LAST_DAY_OF_MONTH",
          "leapMonthPolicy": "NORMAL_MONTH_FALLBACK"
        }
      },
      "expected": {
        "status": "VALID",
        "nextOccurrence": "2026-10-31",
        "futureOccurrences": [
          "2026-10-31",
          "2027-10-31",